{
  "dispatch_request": {
    "mode": "research",
    "profile": "source-collector",
    "capability": "source-acquisition",
    "task": "读取公开静态网页并回收 evidence",
    "target": "https://httpbin.org/html",
    "constraints": [
      "readonly",
      "no_login",
      "no_download",
      "no_private_write"
    ],
    "evidence_policy": {
      "network": "allowed",
      "citations": "required"
    }
  },
  "dispatch_decision": {
    "selected_capability": "source-acquisition",
    "candidate_skills": [
      "web-access",
      "google-ai-mode-skill",
      "mcp-cli"
    ],
    "selected_skill": "web-access",
    "selection_reason": "公开静态网页只读获取，优先使用低风险网页读取能力。",
    "invocation_method": "WebFetch",
    "fallback_skills": [
      "google-ai-mode-skill",
      "mcp-cli"
    ],
    "risk_level": "low",
    "status": "dispatched"
  },
  "dispatch_log": {
    "started_at": "2026-05-14T00:00:00+08:00",
    "dispatch_request": {
      "capability": "source-acquisition",
      "target": "https://httpbin.org/html"
    },
    "dispatch_decision": {
      "selected_skill": "web-access",
      "invocation_method": "WebFetch"
    },
    "invocation": {
      "invoked": true,
      "method": "WebFetch",
      "target": "https://httpbin.org/html",
      "result_status": "success"
    },
    "recovery": {
      "result_recovered": true,
      "recovered_as": [
        "sources[]",
        "evidence[]"
      ]
    },
    "boundaries": [
      "未验证登录态页面",
      "未验证动态 DOM",
      "未验证 fallback"
    ]
  },
  "sources": [
    {
      "title": "Sample HTML Page - httpbin.org",
      "url": "https://httpbin.org/html",
      "source_type": "web",
      "summary": "HTTPBIN HTML sample page for HTTP client testing.",
      "reliability": "medium",
      "freshness": "2026-05-14",
      "extracted_at": "2026-05-14T00:00:00+08:00"
    }
  ],
  "evidence": [
    "https://httpbin.org/html - HTTPBIN HTML sample page, reliability=medium, source_type=web"
  ],
  "boundaries": [
    "该样例是 dispatch 输出契约样例，不代表 Claude Code runtime 已验证。",
    "没有验证登录态、动态 DOM、fallback 或 subagent runtime。"
  ],
  "quality_check": {
    "protocol_complete": true,
    "evidence_boundary_clear": true,
    "actionable": true
  }
}
